{
  "query": "query brain assemble context answer with evidence skills",
  "project": "",
  "created_at": "20260516T153541Z",
  "sources": [
    {
      "path": "brain/context/bundles/20260516T153540Z-andyai-second-brain-current-project-status.json",
      "score": 136.0,
      "kind": "resource",
      "snippet": "{ \"query\": \"AndyAI Second Brain current project status\", \"project\": \"andyai-second-brain\", \"created_at\": \"20260516T153540Z\", \"sources\": [ { \"path\": \"brain/retrieval/20260516T153538Z-evidence-decision-project-context.json\", \"score\": 110.0, \"kind\": \"resource\", \"snippet\": \"{ \\\"query\\\": \\\"evidence decision project context\\\", \\\"project\\\": \\\"\\\", \\\"created_at\\\": \\\"20260516T153538Z\\\", \\\"re",
      "reason": "Matched query terms in resource source.",
      "staleness_warning": ""
    },
    {
      "path": "brain/context/bundles/20260516T153540Z-andyai-second-brain-current-project-status.md",
      "score": 135.0,
      "kind": "resource",
      "snippet": "# Context Bundle — AndyAI Second Brain current project status Created: `20260516T153540Z` Project: `andyai-second-brain` ## Sources ### 1. `brain/retrieval/20260516T153538Z-evidence-decision-project-context.json` - Score: `110.0` - Kind: `resource` - Reason: Matched query terms in resource source. > { \"query\": \"evidence decision project context\", \"project\": \"\", \"created_at\": \"20260516T153538Z\", \"results\": [ { \"p",
      "reason": "Matched query terms in resource source.",
      "staleness_warning": ""
    },
    {
      "path": "brain/retrieval/20260516T153538Z-evidence-decision-project-context.json",
      "score": 111.0,
      "kind": "resource",
      "snippet": "{ \"query\": \"evidence decision project context\", \"project\": \"\", \"created_at\": \"20260516T153538Z\", \"results\": [ { \"path\": \"brain/context/bundles/20260516T153537Z-pack4-context-bundle-schema.json\", \"score\": 41.0, \"kind\": \"resource\", \"snippet\": \"{ \\\"query\\\": \\\"PACK4 context bundle schema\\\", \\\"project\\\": \\\"andyai-second-brain\\\", \\\"created_at\\\": \\\"20260516T153537Z\\\", \\\"sources\\\": [ { \\\"p",
      "reason": "Matched query terms in resource source.",
      "staleness_warning": ""
    },
    {
      "path": "brain/search/brain-index.json",
      "score": 108.0,
      "kind": "resource",
      "snippet": "{ \"created_at\": \"20260516T153536Z\", \"records\": [ { \"path\": \"ANDYAI_CONTEXT.md\", \"kind\": \"resource\", \"tokens\": 122, \"chars\": 945 }, { \"path\": \"SECOND_BRAIN_CANON.md\", \"kind\": \"resource\", \"tokens\": 167, \"chars\": 1234 }, { \"path\": \"README.md\", \"kind\": \"resource\", \"tokens\": 420, \"chars\": 3259 }, { \"path\": \"brain/",
      "reason": "Matched query terms in resource source.",
      "staleness_warning": ""
    },
    {
      "path": "brain/context/bundles/20260516T153539Z-pack3-evidence-decision-runtime-operations.json",
      "score": 97.0,
      "kind": "resource",
      "snippet": "{ \"query\": \"PACK3 evidence decision runtime operations\", \"project\": \"\", \"created_at\": \"20260516T153539Z\", \"sources\": [ { \"path\": \"brain/search/brain-index.json\", \"score\": 54.0, \"kind\": \"resource\", \"snippet\": \"\\\"kind\\\": \\\"resource\\\", \\\"tokens\\\": 23, \\\"chars\\\": 175 }, { \\\"path\\\": \\\"brain/inbox/20260516T143358Z-pack3-sample-inbox-signal.md\\\", \\\"kind\\\": \\\"resource\\\", \\\"tokens\\\": 21, \\\"",
      "reason": "Matched query terms in resource source.",
      "staleness_warning": ""
    },
    {
      "path": "brain/context/bundles/20260516T153537Z-pack4-context-bundle-schema.json",
      "score": 80.0,
      "kind": "resource",
      "snippet": "{ \"query\": \"PACK4 context bundle schema\", \"project\": \"andyai-second-brain\", \"created_at\": \"20260516T153537Z\", \"sources\": [ { \"path\": \"brain/search/brain-index.json\", \"score\": 68.0, \"kind\": \"resource\", \"snippet\": \"{ \\\"created_at\\\": \\\"20260516T153536Z\\\", \\\"records\\\": [ { \\\"path\\\": \\\"ANDYAI_CONTEXT.md\\\", \\\"kind\\\": \\\"resource\\\", \\\"tokens\\\": 122, \\\"chars\\\": 945 }, { \\\"path\\\": \\\"SECOND_B",
      "reason": "Matched query terms in resource source.",
      "staleness_warning": ""
    },
    {
      "path": "brain/context/bundles/20260516T153539Z-pack3-evidence-decision-runtime-operations.md",
      "score": 80.0,
      "kind": "resource",
      "snippet": "# Context Bundle — PACK3 evidence decision runtime operations Created: `20260516T153539Z` Project: `not-specified` ## Sources ### 1. `brain/search/brain-index.json` - Score: `54.0` - Kind: `resource` - Reason: Matched query terms in resource source. > \"kind\": \"resource\", \"tokens\": 23, \"chars\": 175 }, { \"path\": \"brain/inbox/20260516T143358Z-pack3-sample-inbox-signal.md\", \"kind\": \"resource\", \"tokens\": 21, \"chars\":",
      "reason": "Matched query terms in resource source.",
      "staleness_warning": ""
    },
    {
      "path": "brain/context/bundles/20260516T153537Z-pack4-context-bundle-schema.md",
      "score": 79.0,
      "kind": "resource",
      "snippet": "# Context Bundle — PACK4 context bundle schema Created: `20260516T153537Z` Project: `andyai-second-brain` ## Sources ### 1. `brain/search/brain-index.json` - Score: `68.0` - Kind: `resource` - Reason: Matched query terms in resource source. > { \"created_at\": \"20260516T153536Z\", \"records\": [ { \"path\": \"ANDYAI_CONTEXT.md\", \"kind\": \"resource\", \"tokens\": 122, \"chars\": 945 }, { \"path\": \"SECOND_BRAIN_CANON.md\", \"kind\"",
      "reason": "Matched query terms in resource source.",
      "staleness_warning": ""
    },
    {
      "path": "brain/retrieval/20260516T153537Z-pack4-retrieval-result-schema.json",
      "score": 60.0,
      "kind": "resource",
      "snippet": "{ \"query\": \"PACK4 retrieval result schema\", \"project\": \"\", \"created_at\": \"20260516T153537Z\", \"results\": [ { \"path\": \"brain/search/brain-index.json\", \"score\": 55.0, \"kind\": \"resource\", \"snippet\": \"TEAM_BRAIN_MODEL.md\\\", \\\"kind\\\": \\\"resource\\\", \\\"tokens\\\": 36, \\\"chars\\\": 284 }, { \\\"path\\\": \\\"docs/PACK4_QUERY_RETRIEVAL_CONTEXT_ASSEMBLY_TOC.md\\\", \\\"kind\\\": \\\"resource\\\", \\\"tokens\\\": 250",
      "reason": "Matched query terms in resource source.",
      "staleness_warning": ""
    },
    {
      "path": "README.md",
      "score": 56.0,
      "kind": "resource",
      "snippet": "# 🅰️ AndyAI Second Brain A governed AI work-memory layer for people, projects, repositories, decisions, evidence and reusable skills. ## Core Formula **RAG finds fragments.** **Second Brain preserves work continuity.** Serbian: **RAG pronalazi fragmente.** **Drugi mozak čuva kontinuitet rada.** ## What It Is AndyAI Second Brain is structured work memory for human-AI collaboration. It helps answer: - Wher",
      "reason": "Matched query terms in resource source.",
      "staleness_warning": ""
    },
    {
      "path": "docs/PACK4_QUERY_RETRIEVAL_CONTEXT_ASSEMBLY_TOC.md",
      "score": 54.0,
      "kind": "resource",
      "snippet": "# 🤜💥 PACK4 — Brain Query / Retrieval / Context Assembly Layer Range: `v6.1.0 → v8.0.0` ## Mission PACK4 turns AndyAI Second Brain from a local operations system into a practical retrieval and context assembly layer. The brain must now answer a grounded operational question: > What should the agent read before acting? ## Version TOC | Version | Name | Purpose | |---|---|---| | v6.1.0 | Query Runtime Scaffold |",
      "reason": "Matched query terms in resource source.",
      "staleness_warning": ""
    },
    {
      "path": "docs/pack4/BRAIN_QUERY_CLI.md",
      "score": 29.0,
      "kind": "resource",
      "snippet": "# Brain Query CLI ## Commands ```bash runtime/bin/brain-query index runtime/bin/brain-query search \"query\" runtime/bin/brain-query bundle \"query\" runtime/bin/brain-query handoff \"query\" runtime/bin/brain-query answer-draft \"query\" runtime/bin/brain-query report ``` ## Purpose The CLI prepares relevant context before agent action.",
      "reason": "Matched query terms in resource source.",
      "staleness_warning": ""
    }
  ],
  "evidence": [],
  "warnings": [],
  "next_action": "Review context bundle, then decide whether to answer, inspect sources, or request human approval."
}
