{
  "query": "source priority evidence decision project",
  "project": "",
  "created_at": "20260516T153544Z",
  "sources": [
    {
      "path": "brain/context/bundles/20260516T153541Z-query-brain-assemble-context-answer-with-evidence-skills.json",
      "score": 125.0,
      "kind": "resource",
      "snippet": "{ \"query\": \"query brain assemble context answer with evidence skills\", \"project\": \"\", \"created_at\": \"20260516T153541Z\", \"sources\": [ { \"path\": \"brain/context/bundles/20260516T153540Z-andyai-second-brain-current-project-status.json\", \"score\": 136.0, \"kind\": \"resource\", \"snippet\": \"{ \\\"query\\\": \\\"AndyAI Second Brain current project status\\\", \\\"project\\\": \\\"andyai-second-brain\\\", \\\"cr",
      "reason": "Matched query terms in resource source.",
      "staleness_warning": ""
    },
    {
      "path": "brain/context/bundles/20260516T153541Z-query-brain-assemble-context-answer-with-evidence-skills.md",
      "score": 124.0,
      "kind": "resource",
      "snippet": "# Context Bundle — query brain assemble context answer with evidence skills Created: `20260516T153541Z` Project: `not-specified` ## Sources ### 1. `brain/context/bundles/20260516T153540Z-andyai-second-brain-current-project-status.json` - Score: `136.0` - Kind: `resource` - Reason: Matched query terms in resource source. > { \"query\": \"AndyAI Second Brain current project status\", \"project\": \"andyai-second-brain\",",
      "reason": "Matched query terms in resource source.",
      "staleness_warning": ""
    },
    {
      "path": "brain/context/handoffs/20260516T153541Z-prepare-pack5-for-andyai-second-brain-agent-handoff.md",
      "score": 120.0,
      "kind": "resource",
      "snippet": "Brain ## Instruction Use this handoff as the minimal context set before acting. Do not assume unstated facts. Inspect sources if needed. # Context Bundle — prepare PACK5 for AndyAI Second Brain Created: `20260516T153541Z` Project: `andyai-second-brain` ## Sources ### 1. `brain/context/bundles/20260516T153540Z-andyai-second-brain-current-project-status.json` - Score: `133.0` - Kind: `resource` - Reason: Matched",
      "reason": "Matched query terms in resource source.",
      "staleness_warning": ""
    },
    {
      "path": "brain/retrieval/20260516T153538Z-evidence-decision-project-context.json",
      "score": 106.0,
      "kind": "resource",
      "snippet": "{ \"query\": \"evidence decision project context\", \"project\": \"\", \"created_at\": \"20260516T153538Z\", \"results\": [ { \"path\": \"brain/context/bundles/20260516T153537Z-pack4-context-bundle-schema.json\", \"score\": 41.0, \"kind\": \"resource\", \"snippet\": \"{ \\\"query\\\": \\\"PACK4 context bundle schema\\\", \\\"project\\\": \\\"andyai-second-brain\\\", \\\"created_at\\\": \\\"20260516T153537Z\\\", \\\"sources\\\": [ { \\\"p",
      "reason": "Matched query terms in resource source.",
      "staleness_warning": ""
    },
    {
      "path": "brain/search/brain-index.json",
      "score": 105.0,
      "kind": "resource",
      "snippet": "{ \"created_at\": \"20260516T153536Z\", \"records\": [ { \"path\": \"ANDYAI_CONTEXT.md\", \"kind\": \"resource\", \"tokens\": 122, \"chars\": 945 }, { \"path\": \"SECOND_BRAIN_CANON.md\", \"kind\": \"resource\", \"tokens\": 167, \"chars\": 1234 }, { \"path\": \"README.md\", \"kind\": \"resource\", \"tokens\": 420, \"chars\": 3259 }, { \"path\": \"brain/",
      "reason": "Matched query terms in resource source.",
      "staleness_warning": ""
    },
    {
      "path": "brain/context/bundles/20260516T153540Z-andyai-second-brain-current-project-status.json",
      "score": 99.0,
      "kind": "resource",
      "snippet": "{ \"query\": \"AndyAI Second Brain current project status\", \"project\": \"andyai-second-brain\", \"created_at\": \"20260516T153540Z\", \"sources\": [ { \"path\": \"brain/retrieval/20260516T153538Z-evidence-decision-project-context.json\", \"score\": 110.0, \"kind\": \"resource\", \"snippet\": \"{ \\\"query\\\": \\\"evidence decision project context\\\", \\\"project\\\": \\\"\\\", \\\"created_at\\\": \\\"20260516T153538Z\\\", \\\"re",
      "reason": "Matched query terms in resource source.",
      "staleness_warning": ""
    },
    {
      "path": "brain/context/bundles/20260516T153540Z-andyai-second-brain-current-project-status.md",
      "score": 98.0,
      "kind": "resource",
      "snippet": "# Context Bundle — AndyAI Second Brain current project status Created: `20260516T153540Z` Project: `andyai-second-brain` ## Sources ### 1. `brain/retrieval/20260516T153538Z-evidence-decision-project-context.json` - Score: `110.0` - Kind: `resource` - Reason: Matched query terms in resource source. > { \"query\": \"evidence decision project context\", \"project\": \"\", \"created_at\": \"20260516T153538Z\", \"results\": [ { \"p",
      "reason": "Matched query terms in resource source.",
      "staleness_warning": ""
    },
    {
      "path": "brain/context/bundles/20260516T153539Z-pack3-evidence-decision-runtime-operations.json",
      "score": 91.0,
      "kind": "resource",
      "snippet": "{ \"query\": \"PACK3 evidence decision runtime operations\", \"project\": \"\", \"created_at\": \"20260516T153539Z\", \"sources\": [ { \"path\": \"brain/search/brain-index.json\", \"score\": 54.0, \"kind\": \"resource\", \"snippet\": \"\\\"kind\\\": \\\"resource\\\", \\\"tokens\\\": 23, \\\"chars\\\": 175 }, { \\\"path\\\": \\\"brain/inbox/20260516T143358Z-pack3-sample-inbox-signal.md\\\", \\\"kind\\\": \\\"resource\\\", \\\"tokens\\\": 21, \\\"",
      "reason": "Matched query terms in resource source.",
      "staleness_warning": ""
    }
  ],
  "evidence": [],
  "warnings": [],
  "next_action": "Review context bundle, then decide whether to answer, inspect sources, or request human approval."
}
