{
  "query": "staleness archive deprecated warning",
  "project": "",
  "created_at": "20260516T153545Z",
  "sources": [
    {
      "path": "brain/retrieval/20260516T153538Z-evidence-decision-project-context.json",
      "score": 26.0,
      "kind": "resource",
      "snippet": "\\\\\\\"chars\\\\\\\": 945 }, { \\\\\\\"path\\\\\\\": \\\\\\\"SECOND_B\", \"reason\": \"Matched query terms in resource source.\", \"staleness_warning\": \"\" }, { \"path\": \"brain/context/bundles/20260516T153537Z-pack4-context-bundle-schema.md\", \"score\": 41.0, \"kind\": \"resource\", \"snippet\": \"# Context Bundle — PACK4 context bundle schema Created: `20260516T153537Z` Project: `andyai-second-brain` ## Sou",
      "reason": "Matched query terms in resource source.",
      "staleness_warning": ""
    },
    {
      "path": "brain/context/bundles/20260516T153541Z-query-brain-assemble-context-answer-with-evidence-skills.json",
      "score": 25.0,
      "kind": "resource",
      "snippet": "\\\\\"created_at\\\\\\\": \\\\\\\"20260516T153538Z\\\\\\\", \\\\\\\"re\", \"reason\": \"Matched query terms in resource source.\", \"staleness_warning\": \"\" }, { \"path\": \"brain/context/bundles/20260516T153540Z-andyai-second-brain-current-project-status.md\", \"score\": 135.0, \"kind\": \"resource\", \"snippet\": \"# Context Bundle — AndyAI Second Brain current project status Created: `20260516T153540Z` Projec",
      "reason": "Matched query terms in resource source.",
      "staleness_warning": ""
    },
    {
      "path": "brain/context/bundles/20260516T153539Z-pack3-evidence-decision-runtime-operations.json",
      "score": 25.0,
      "kind": "resource",
      "snippet": "31, \\\"chars\\\": 246 }, { \\\"path\\\": \\\"brain/evidence/\", \"reason\": \"Matched query terms in resource source.\", \"staleness_warning\": \"\" }, { \"path\": \"README.md\", \"score\": 38.0, \"kind\": \"resource\", \"snippet\": \"# 🅰️ AndyAI Second Brain A governed AI work-memory layer for people, projects, repositories, decisions, evidence and reusable skills. ## Core Formula **RAG finds fragments.",
      "reason": "Matched query terms in resource source.",
      "staleness_warning": ""
    },
    {
      "path": "brain/context/bundles/20260516T153540Z-andyai-second-brain-current-project-status.json",
      "score": 25.0,
      "kind": "resource",
      "snippet": "\\\\\"20260516T153537Z\\\\\\\", \\\\\\\"sources\\\\\\\": [ { \\\\\\\"p\", \"reason\": \"Matched query terms in resource source.\", \"staleness_warning\": \"\" }, { \"path\": \"brain/search/brain-index.json\", \"score\": 97.0, \"kind\": \"resource\", \"snippet\": \"{ \\\"created_at\\\": \\\"20260516T153536Z\\\", \\\"records\\\": [ { \\\"path\\\": \\\"ANDYAI_CONTEXT.md\\\", \\\"kind\\\": \\\"resource\\\", \\\"tokens\\\": 122, \\\"chars\\\": 945 }, { \\",
      "reason": "Matched query terms in resource source.",
      "staleness_warning": ""
    },
    {
      "path": "brain/context/bundles/20260516T153537Z-pack4-context-bundle-schema.json",
      "score": 19.0,
      "kind": "resource",
      "snippet": "ens\\\": 420, \\\"chars\\\": 3259 }, { \\\"path\\\": \\\"brain/\", \"reason\": \"Matched query terms in resource source.\", \"staleness_warning\": \"\" }, { \"path\": \"brain/retrieval/20260516T153537Z-pack4-retrieval-result-schema.json\", \"score\": 67.0, \"kind\": \"resource\", \"snippet\": \"{ \\\"query\\\": \\\"PACK4 retrieval result schema\\\", \\\"project\\\": \\\"\\\", \\\"created_at\\\": \\\"20260516T153537Z\\\", \\\"results",
      "reason": "Matched query terms in resource source.",
      "staleness_warning": ""
    },
    {
      "path": "brain/retrieval/20260516T153537Z-pack4-retrieval-result-schema.json",
      "score": 19.0,
      "kind": "resource",
      "snippet": "283 }, { \\\"path\\\": \\\"docs/PACK3_TOC.md\\\", \\\"kind\\\"\", \"reason\": \"Matched query terms in resource source.\", \"staleness_warning\": \"\" }, { \"path\": \"docs/PACK4_QUERY_RETRIEVAL_CONTEXT_ASSEMBLY_TOC.md\", \"score\": 28.0, \"kind\": \"resource\", \"snippet\": \"# 🤜💥 PACK4 — Brain Query / Retrieval / Context Assembly Layer Range: `v6.1.0 → v8.0.0` ## Mission PACK4 turns AndyAI Second Brain f",
      "reason": "Matched query terms in resource source.",
      "staleness_warning": ""
    },
    {
      "path": "brain/context/bundles/20260516T153544Z-source-priority-evidence-decision-project.json",
      "score": 17.0,
      "kind": "resource",
      "snippet": "\\\\\"project\\\\\\\": \\\\\\\"andyai-second-brain\\\\\\\", \\\\\\\"cr\", \"reason\": \"Matched query terms in resource source.\", \"staleness_warning\": \"\" }, { \"path\": \"brain/context/bundles/20260516T153541Z-query-brain-assemble-context-answer-with-evidence-skills.md\", \"score\": 124.0, \"kind\": \"resource\", \"snippet\": \"# Context Bundle — query brain assemble context answer with evidence skills Create",
      "reason": "Matched query terms in resource source.",
      "staleness_warning": ""
    },
    {
      "path": "brain/context/bundles/20260516T153544Z-context-budget-progressive-disclosure-policy.json",
      "score": 17.0,
      "kind": "resource",
      "snippet": "ect status\\\", \\\"project\\\": \\\"andyai-second-brain\\\",\", \"reason\": \"Matched query terms in resource source.\", \"staleness_warning\": \"\" }, { \"path\": \"brain/retrieval/20260516T153538Z-evidence-decision-project-context.json\", \"score\": 37.0, \"kind\": \"resource\", \"snippet\": \"{ \\\"query\\\": \\\"evidence decision project context\\\", \\\"project\\\": \\\"\\\", \\\"created_at\\\": \\\"20260516T153538Z\\\", \\",
      "reason": "Matched query terms in resource source.",
      "staleness_warning": ""
    }
  ],
  "evidence": [],
  "warnings": [],
  "next_action": "Review context bundle, then decide whether to answer, inspect sources, or request human approval."
}
