{
  "query": "PACK3 evidence decision runtime operations",
  "project": "",
  "created_at": "20260516T153539Z",
  "sources": [
    {
      "path": "brain/search/brain-index.json",
      "score": 54.0,
      "kind": "resource",
      "snippet": "\"kind\": \"resource\", \"tokens\": 23, \"chars\": 175 }, { \"path\": \"brain/inbox/20260516T143358Z-pack3-sample-inbox-signal.md\", \"kind\": \"resource\", \"tokens\": 21, \"chars\": 154 }, { \"path\": \"brain/evidence/20260516T143622Z-pack3-runtime-operations-exist.md\", \"kind\": \"evidence\", \"tokens\": 31, \"chars\": 246 }, { \"path\": \"brain/evidence/",
      "reason": "Matched query terms in resource source.",
      "staleness_warning": ""
    },
    {
      "path": "README.md",
      "score": 38.0,
      "kind": "resource",
      "snippet": "# 🅰️ AndyAI Second Brain A governed AI work-memory layer for people, projects, repositories, decisions, evidence and reusable skills. ## Core Formula **RAG finds fragments.** **Second Brain preserves work continuity.** Serbian: **RAG pronalazi fragmente.** **Drugi mozak čuva kontinuitet rada.** ## What It Is AndyAI Second Brain is structured work memory for human-AI collaboration. It helps answer: - Wher",
      "reason": "Matched query terms in resource source.",
      "staleness_warning": ""
    },
    {
      "path": "brain/evidence/20260516T143622Z-pack3-runtime-operations-exist.md",
      "score": 28.0,
      "kind": "evidence",
      "snippet": "# Evidence Link — PACK3 runtime operations exist Created: 2026-05-16T14:36:22Z ## Claim PACK3 runtime operations exist ## Evidence runtime/bin/brain supports inbox, route, search, dashboard and export ## Source local repo ## Confidence high",
      "reason": "Matched query terms in evidence source.",
      "staleness_warning": ""
    },
    {
      "path": "brain/retrieval/20260516T153538Z-evidence-decision-project-context.json",
      "score": 23.0,
      "kind": "resource",
      "snippet": "{ \"query\": \"evidence decision project context\", \"project\": \"\", \"created_at\": \"20260516T153538Z\", \"results\": [ { \"path\": \"brain/context/bundles/20260516T153537Z-pack4-context-bundle-schema.json\", \"score\": 41.0, \"kind\": \"resource\", \"snippet\": \"{ \\\"query\\\": \\\"PACK4 context bundle schema\\\", \\\"project\\\": \\\"andyai-second-brain\\\", \\\"created_at\\\": \\\"20260516T153537Z\\\", \\\"sources\\\": [ { \\\"p",
      "reason": "Matched query terms in resource source.",
      "staleness_warning": ""
    },
    {
      "path": "docs/runtime/WORKING_BRAIN_RUNTIME_LAYER.md",
      "score": 19.0,
      "kind": "resource",
      "snippet": "# 🧠 Working Brain Runtime Layer The Working Brain Runtime Layer is the first practical runtime for AndyAI Second Brain. It does not replace human judgment. It creates local, inspectable files that help humans and AI agents preserve work continuity. ## Runtime Loop ```text intake → classify → route → write → verify → report → human review ``` ## Local-First Rule All runtime actions write to local files first. Pu",
      "reason": "Matched query terms in resource source.",
      "staleness_warning": ""
    },
    {
      "path": "brain/evidence/pack2-runtime-exists.md",
      "score": 15.0,
      "kind": "evidence",
      "snippet": "# Evidence Link ## Claim PACK2 runtime exists ## Evidence runtime/bin/brain and verification scripts exist. ## Status linked ## Created At 2026-05-16T14:25:29Z",
      "reason": "Matched query terms in evidence source.",
      "staleness_warning": ""
    },
    {
      "path": "docs/toc/PACK2_v2.1_to_v4.0_TOC.md",
      "score": 15.0,
      "kind": "resource",
      "snippet": "# 🅰️✅ PACK2 TOC — Working Brain Runtime Layer Owner: Andrija Kolundzic / Japan IT Business System: AndyAI.ai Repo: `andyai-second-brain` Range: `v2.1.0 → v4.0.0` Mode: TAP-TAP v2 simplified UX ## TAP-TAP UX - TAP 1: unzip ZIP package - TAP 2: run terminal script ## Version Map | Version | Milestone | |---|---| | v2.1.0 | Runtime Folder Scaffold | | v2.2.0 | Brain Index Generator | | v2.3.0 | Memory Entry",
      "reason": "Matched query terms in resource source.",
      "staleness_warning": ""
    },
    {
      "path": "brain/decisions/adopt-local-runtime-layer.md",
      "score": 14.0,
      "kind": "decision",
      "snippet": "# Decision ## Decision Adopt local runtime layer ## Reason Second Brain needs practical local commands. ## Status needs-review ## Created At 2026-05-16T14:25:29Z",
      "reason": "Matched query terms in decision source.",
      "staleness_warning": ""
    },
    {
      "path": "docs/PACK3_TOC.md",
      "score": 14.0,
      "kind": "resource",
      "snippet": "# 🤜💥 PACK3 TOC — Real Brain Operations Layer Range: v4.1.0 → v6.0.0 ## Goal Move AndyAI Second Brain from a basic local runtime into a practical brain operations layer that can intake, route, search, snapshot, report, approve, inspect and export work memory. ## Versions - v4.1.0 — Pack3 Operations TOC - v4.2.0 — Inbox Intake Operation - v4.3.0 — Routing Rules Operation - v4.4.0 — Context Router v1 - v4.5.0 — Searc",
      "reason": "Matched query terms in resource source.",
      "staleness_warning": ""
    },
    {
      "path": "brain/decisions/20260516T143623Z-pack3-remains-local-first.md",
      "score": 13.0,
      "kind": "decision",
      "snippet": "# Decision — PACK3 remains local-first Created: 2026-05-16T14:36:23Z ## Reason Human approval remains required for external actions ## Approval human ## Status approved",
      "reason": "Matched query terms in decision source.",
      "staleness_warning": ""
    }
  ],
  "evidence": [
    {
      "path": "brain/evidence/20260516T143622Z-pack3-runtime-operations-exist.md",
      "score": 28.0,
      "kind": "evidence",
      "snippet": "# Evidence Link — PACK3 runtime operations exist Created: 2026-05-16T14:36:22Z ## Claim PACK3 runtime operations exist ## Evidence runtime/bin/brain supports inbox, route, search, dashboard and export ## Source local repo ## Confidence high",
      "reason": "Matched query terms in evidence source.",
      "staleness_warning": ""
    },
    {
      "path": "brain/evidence/pack2-runtime-exists.md",
      "score": 15.0,
      "kind": "evidence",
      "snippet": "# Evidence Link ## Claim PACK2 runtime exists ## Evidence runtime/bin/brain and verification scripts exist. ## Status linked ## Created At 2026-05-16T14:25:29Z",
      "reason": "Matched query terms in evidence source.",
      "staleness_warning": ""
    }
  ],
  "warnings": [],
  "next_action": "Review context bundle, then decide whether to answer, inspect sources, or request human approval."
}
