{
  "query": "TAP-TAP Canonizer Knowledge Factory Director Memory Runtime Agent Discipline",
  "project": "",
  "created_at": "20260516T153546Z",
  "sources": [
    {
      "path": "brain/context/bundles/20260516T153539Z-pack3-evidence-decision-runtime-operations.json",
      "score": 39.0,
      "kind": "resource",
      "snippet": "{ \"query\": \"PACK3 evidence decision runtime operations\", \"project\": \"\", \"created_at\": \"20260516T153539Z\", \"sources\": [ { \"path\": \"brain/search/brain-index.json\", \"score\": 54.0, \"kind\": \"resource\", \"snippet\": \"\\\"kind\\\": \\\"resource\\\", \\\"tokens\\\": 23, \\\"chars\\\": 175 }, { \\\"path\\\": \\\"brain/inbox/20260516T143358Z-pack3-sample-inbox-signal.md\\\", \\\"kind\\\": \\\"resource\\\", \\\"tokens\\\": 21, \\\"",
      "reason": "Matched query terms in resource source.",
      "staleness_warning": ""
    },
    {
      "path": "README.md",
      "score": 35.0,
      "kind": "resource",
      "snippet": "# 🅰️ AndyAI Second Brain A governed AI work-memory layer for people, projects, repositories, decisions, evidence and reusable skills. ## Core Formula **RAG finds fragments.** **Second Brain preserves work continuity.** Serbian: **RAG pronalazi fragmente.** **Drugi mozak čuva kontinuitet rada.** ## What It Is AndyAI Second Brain is structured work memory for human-AI collaboration. It helps answer: - Wher",
      "reason": "Matched query terms in resource source.",
      "staleness_warning": ""
    },
    {
      "path": "brain/context/bundles/20260516T153539Z-pack3-evidence-decision-runtime-operations.md",
      "score": 32.0,
      "kind": "resource",
      "snippet": "# Context Bundle — PACK3 evidence decision runtime operations Created: `20260516T153539Z` Project: `not-specified` ## Sources ### 1. `brain/search/brain-index.json` - Score: `54.0` - Kind: `resource` - Reason: Matched query terms in resource source. > \"kind\": \"resource\", \"tokens\": 23, \"chars\": 175 }, { \"path\": \"brain/inbox/20260516T143358Z-pack3-sample-inbox-signal.md\", \"kind\": \"resource\", \"tokens\": 21, \"chars\":",
      "reason": "Matched query terms in resource source.",
      "staleness_warning": ""
    },
    {
      "path": "brain/search/brain-index.json",
      "score": 31.0,
      "kind": "resource",
      "snippet": "\": \"resource\", \"tokens\": 21, \"chars\": 154 }, { \"path\": \"brain/evidence/20260516T143622Z-pack3-runtime-operations-exist.md\", \"kind\": \"evidence\", \"tokens\": 31, \"chars\": 246 }, { \"path\": \"brain/evidence/pack2-runtime-exists.md\", \"kind\": \"evidence\", \"tokens\": 21, \"chars\": 164 }, { \"path\": \"brain/projects/andyai-second-brain/PROJECT_",
      "reason": "Matched query terms in resource source.",
      "staleness_warning": ""
    },
    {
      "path": "brain/context/bundles/20260516T153540Z-andyai-second-brain-current-project-status.json",
      "score": 17.0,
      "kind": "resource",
      "snippet": "\"staleness_warning\": \"\" }, { \"path\": \"brain/context/bundles/20260516T153539Z-pack3-evidence-decision-runtime-operations.json\", \"score\": 79.0, \"kind\": \"resource\", \"snippet\": \"{ \\\"query\\\": \\\"PACK3 evidence decision runtime operations\\\", \\\"project\\\": \\\"\\\", \\\"created_at\\\": \\\"20260516T153539Z\\\", \\\"sources\\\": [ { \\\"path\\\": \\\"brain/search/brain-index.json\\\", \\\"score\\\": 54.0, \\\"kind\\\": \\\"",
      "reason": "Matched query terms in resource source.",
      "staleness_warning": ""
    },
    {
      "path": "brain/context/bundles/20260516T153540Z-andyai-second-brain-current-project-status.md",
      "score": 17.0,
      "kind": "resource",
      "snippet": "okens\": 420, \"chars\": 3259 }, { \"path\": \"brain/ ### 3. `brain/context/bundles/20260516T153539Z-pack3-evidence-decision-runtime-operations.json` - Score: `79.0` - Kind: `resource` - Reason: Matched query terms in resource source. > { \"query\": \"PACK3 evidence decision runtime operations\", \"project\": \"\", \"created_at\": \"20260516T153539Z\", \"sources\": [ { \"path\": \"brain/search/brain-index.json\", \"score\": 54.0, \"kind\": \"",
      "reason": "Matched query terms in resource source.",
      "staleness_warning": ""
    },
    {
      "path": "docs/runtime/WORKING_BRAIN_RUNTIME_LAYER.md",
      "score": 17.0,
      "kind": "resource",
      "snippet": "# 🧠 Working Brain Runtime Layer The Working Brain Runtime Layer is the first practical runtime for AndyAI Second Brain. It does not replace human judgment. It creates local, inspectable files that help humans and AI agents preserve work continuity. ## Runtime Loop ```text intake → classify → route → write → verify → report → human review ``` ## Local-First Rule All runtime actions write to local files first. Pu",
      "reason": "Matched query terms in resource source.",
      "staleness_warning": ""
    },
    {
      "path": "brain/context/bundles/20260516T153541Z-query-brain-assemble-context-answer-with-evidence-skills.json",
      "score": 15.0,
      "kind": "resource",
      "snippet": "\"staleness_warning\": \"\" }, { \"path\": \"brain/context/bundles/20260516T153539Z-pack3-evidence-decision-runtime-operations.json\", \"score\": 97.0, \"kind\": \"resource\", \"snippet\": \"{ \\\"query\\\": \\\"PACK3 evidence decision runtime operations\\\", \\\"project\\\": \\\"\\\", \\\"created_at\\\": \\\"20260516T153539Z\\\", \\\"sources\\\": [ { \\\"path\\\": \\\"brain/search/brain-index.json\\\", \\\"score\\\": 54.0, \\\"kind\\\": \\\"",
      "reason": "Matched query terms in resource source.",
      "staleness_warning": ""
    },
    {
      "path": "brain/context/bundles/20260516T153541Z-query-brain-assemble-context-answer-with-evidence-skills.md",
      "score": 15.0,
      "kind": "resource",
      "snippet": "okens\": 420, \"chars\": 3259 }, { \"path\": \"brain/ ### 5. `brain/context/bundles/20260516T153539Z-pack3-evidence-decision-runtime-operations.json` - Score: `97.0` - Kind: `resource` - Reason: Matched query terms in resource source. > { \"query\": \"PACK3 evidence decision runtime operations\", \"project\": \"\", \"created_at\": \"20260516T153539Z\", \"sources\": [ { \"path\": \"brain/search/brain-index.json\", \"score\": 54.0, \"kind\": \"",
      "reason": "Matched query terms in resource source.",
      "staleness_warning": ""
    },
    {
      "path": "docs/toc/PACK2_v2.1_to_v4.0_TOC.md",
      "score": 15.0,
      "kind": "resource",
      "snippet": "# 🅰️✅ PACK2 TOC — Working Brain Runtime Layer Owner: Andrija Kolundzic / Japan IT Business System: AndyAI.ai Repo: `andyai-second-brain` Range: `v2.1.0 → v4.0.0` Mode: TAP-TAP v2 simplified UX ## TAP-TAP UX - TAP 1: unzip ZIP package - TAP 2: run terminal script ## Version Map | Version | Milestone | |---|---| | v2.1.0 | Runtime Folder Scaffold | | v2.2.0 | Brain Index Generator | | v2.3.0 | Memory Entry",
      "reason": "Matched query terms in resource source.",
      "staleness_warning": ""
    },
    {
      "path": "skills/runtime-memory-create.md",
      "score": 14.5,
      "kind": "skill",
      "snippet": "# Skill — Runtime Memory Create ## Purpose Create a local memory entry that starts as `needs-review`. ## Command ```bash ./runtime/bin/brain memory-create \"Title\" \"Body\" ```",
      "reason": "Matched query terms in skill source.",
      "staleness_warning": ""
    },
    {
      "path": "brain/resources/pack2-runtime-memory.md",
      "score": 14.0,
      "kind": "resource",
      "snippet": "# Memory Entry ## Title PACK2 Runtime Memory ## Body Working Brain Runtime Layer introduced local memory creation. ## Type working-memory ## Status needs-review ## Evidence TBD ## Created At 2026-05-16T14:22:43Z",
      "reason": "Matched query terms in resource source.",
      "staleness_warning": ""
    }
  ],
  "evidence": [],
  "warnings": [],
  "next_action": "Review context bundle, then decide whether to answer, inspect sources, or request human approval."
}
