{
  "query": "context budget progressive disclosure policy",
  "project": "",
  "created_at": "20260516T153544Z",
  "sources": [
    {
      "path": "brain/context/bundles/20260516T153541Z-query-brain-assemble-context-answer-with-evidence-skills.md",
      "score": 37.0,
      "kind": "resource",
      "snippet": "# Context Bundle — query brain assemble context answer with evidence skills Created: `20260516T153541Z` Project: `not-specified` ## Sources ### 1. `brain/context/bundles/20260516T153540Z-andyai-second-brain-current-project-status.json` - Score: `136.0` - Kind: `resource` - Reason: Matched query terms in resource source. > { \"query\": \"AndyAI Second Brain current project status\", \"project\": \"andyai-second-brain\",",
      "reason": "Matched query terms in resource source.",
      "staleness_warning": ""
    },
    {
      "path": "brain/retrieval/20260516T153538Z-evidence-decision-project-context.json",
      "score": 37.0,
      "kind": "resource",
      "snippet": "{ \"query\": \"evidence decision project context\", \"project\": \"\", \"created_at\": \"20260516T153538Z\", \"results\": [ { \"path\": \"brain/context/bundles/20260516T153537Z-pack4-context-bundle-schema.json\", \"score\": 41.0, \"kind\": \"resource\", \"snippet\": \"{ \\\"query\\\": \\\"PACK4 context bundle schema\\\", \\\"project\\\": \\\"andyai-second-brain\\\", \\\"created_at\\\": \\\"20260516T153537Z\\\", \\\"sources\\\": [ { \\\"p",
      "reason": "Matched query terms in resource source.",
      "staleness_warning": ""
    },
    {
      "path": "brain/context/bundles/20260516T153541Z-query-brain-assemble-context-answer-with-evidence-skills.json",
      "score": 36.0,
      "kind": "resource",
      "snippet": "{ \"query\": \"query brain assemble context answer with evidence skills\", \"project\": \"\", \"created_at\": \"20260516T153541Z\", \"sources\": [ { \"path\": \"brain/context/bundles/20260516T153540Z-andyai-second-brain-current-project-status.json\", \"score\": 136.0, \"kind\": \"resource\", \"snippet\": \"{ \\\"query\\\": \\\"AndyAI Second Brain current project status\\\", \\\"project\\\": \\\"andyai-second-brain\\\", \\\"cr",
      "reason": "Matched query terms in resource source.",
      "staleness_warning": ""
    },
    {
      "path": "brain/context/handoffs/20260516T153541Z-prepare-pack5-for-andyai-second-brain-agent-handoff.md",
      "score": 35.0,
      "kind": "resource",
      "snippet": "# Agent Handoff — prepare PACK5 for AndyAI Second Brain ## Instruction Use this handoff as the minimal context set before acting. Do not assume unstated facts. Inspect sources if needed. # Context Bundle — prepare PACK5 for AndyAI Second Brain Created: `20260516T153541Z` Project: `andyai-second-brain` ## Sources ### 1. `brain/context/bundles/20260516T153540Z-andyai-second-brain-current-project-status.json` - S",
      "reason": "Matched query terms in resource source.",
      "staleness_warning": ""
    },
    {
      "path": "brain/context/bundles/20260516T153537Z-pack4-context-bundle-schema.md",
      "score": 30.0,
      "kind": "resource",
      "snippet": "# Context Bundle — PACK4 context bundle schema Created: `20260516T153537Z` Project: `andyai-second-brain` ## Sources ### 1. `brain/search/brain-index.json` - Score: `68.0` - Kind: `resource` - Reason: Matched query terms in resource source. > { \"created_at\": \"20260516T153536Z\", \"records\": [ { \"path\": \"ANDYAI_CONTEXT.md\", \"kind\": \"resource\", \"tokens\": 122, \"chars\": 945 }, { \"path\": \"SECOND_BRAIN_CANON.md\", \"kind\"",
      "reason": "Matched query terms in resource source.",
      "staleness_warning": ""
    },
    {
      "path": "docs/PACK4_QUERY_RETRIEVAL_CONTEXT_ASSEMBLY_TOC.md",
      "score": 30.0,
      "kind": "resource",
      "snippet": "# 🤜💥 PACK4 — Brain Query / Retrieval / Context Assembly Layer Range: `v6.1.0 → v8.0.0` ## Mission PACK4 turns AndyAI Second Brain from a local operations system into a practical retrieval and context assembly layer. The brain must now answer a grounded operational question: > What should the agent read before acting? ## Version TOC | Version | Name | Purpose | |---|---|---| | v6.1.0 | Query Runtime Scaffold |",
      "reason": "Matched query terms in resource source.",
      "staleness_warning": ""
    },
    {
      "path": "brain/context/bundles/20260516T153537Z-pack4-context-bundle-schema.json",
      "score": 29.0,
      "kind": "resource",
      "snippet": "{ \"query\": \"PACK4 context bundle schema\", \"project\": \"andyai-second-brain\", \"created_at\": \"20260516T153537Z\", \"sources\": [ { \"path\": \"brain/search/brain-index.json\", \"score\": 68.0, \"kind\": \"resource\", \"snippet\": \"{ \\\"created_at\\\": \\\"20260516T153536Z\\\", \\\"records\\\": [ { \\\"path\\\": \\\"ANDYAI_CONTEXT.md\\\", \\\"kind\\\": \\\"resource\\\", \\\"tokens\\\": 122, \\\"chars\\\": 945 }, { \\\"path\\\": \\\"SECOND_B",
      "reason": "Matched query terms in resource source.",
      "staleness_warning": ""
    },
    {
      "path": "brain/context/bundles/20260516T153540Z-andyai-second-brain-current-project-status.md",
      "score": 25.0,
      "kind": "resource",
      "snippet": "# Context Bundle — AndyAI Second Brain current project status Created: `20260516T153540Z` Project: `andyai-second-brain` ## Sources ### 1. `brain/retrieval/20260516T153538Z-evidence-decision-project-context.json` - Score: `110.0` - Kind: `resource` - Reason: Matched query terms in resource source. > { \"query\": \"evidence decision project context\", \"project\": \"\", \"created_at\": \"20260516T153538Z\", \"results\": [ { \"p",
      "reason": "Matched query terms in resource source.",
      "staleness_warning": ""
    }
  ],
  "evidence": [],
  "warnings": [],
  "next_action": "Review context bundle, then decide whether to answer, inspect sources, or request human approval."
}
