{
  "query": "AndyAI Second Brain current project status",
  "project": "andyai-second-brain",
  "created_at": "20260516T153540Z",
  "sources": [
    {
      "path": "brain/retrieval/20260516T153538Z-evidence-decision-project-context.json",
      "score": 110.0,
      "kind": "resource",
      "snippet": "{ \"query\": \"evidence decision project context\", \"project\": \"\", \"created_at\": \"20260516T153538Z\", \"results\": [ { \"path\": \"brain/context/bundles/20260516T153537Z-pack4-context-bundle-schema.json\", \"score\": 41.0, \"kind\": \"resource\", \"snippet\": \"{ \\\"query\\\": \\\"PACK4 context bundle schema\\\", \\\"project\\\": \\\"andyai-second-brain\\\", \\\"created_at\\\": \\\"20260516T153537Z\\\", \\\"sources\\\": [ { \\\"p",
      "reason": "Matched query terms in resource source.",
      "staleness_warning": ""
    },
    {
      "path": "brain/search/brain-index.json",
      "score": 97.0,
      "kind": "resource",
      "snippet": "{ \"created_at\": \"20260516T153536Z\", \"records\": [ { \"path\": \"ANDYAI_CONTEXT.md\", \"kind\": \"resource\", \"tokens\": 122, \"chars\": 945 }, { \"path\": \"SECOND_BRAIN_CANON.md\", \"kind\": \"resource\", \"tokens\": 167, \"chars\": 1234 }, { \"path\": \"README.md\", \"kind\": \"resource\", \"tokens\": 420, \"chars\": 3259 }, { \"path\": \"brain/",
      "reason": "Matched query terms in resource source.",
      "staleness_warning": ""
    },
    {
      "path": "brain/context/bundles/20260516T153539Z-pack3-evidence-decision-runtime-operations.json",
      "score": 79.0,
      "kind": "resource",
      "snippet": "{ \"query\": \"PACK3 evidence decision runtime operations\", \"project\": \"\", \"created_at\": \"20260516T153539Z\", \"sources\": [ { \"path\": \"brain/search/brain-index.json\", \"score\": 54.0, \"kind\": \"resource\", \"snippet\": \"\\\"kind\\\": \\\"resource\\\", \\\"tokens\\\": 23, \\\"chars\\\": 175 }, { \\\"path\\\": \\\"brain/inbox/20260516T143358Z-pack3-sample-inbox-signal.md\\\", \\\"kind\\\": \\\"resource\\\", \\\"tokens\\\": 21, \\\"",
      "reason": "Matched query terms in resource source.",
      "staleness_warning": ""
    },
    {
      "path": "README.md",
      "score": 76.0,
      "kind": "resource",
      "snippet": "# 🅰️ AndyAI Second Brain A governed AI work-memory layer for people, projects, repositories, decisions, evidence and reusable skills. ## Core Formula **RAG finds fragments.** **Second Brain preserves work continuity.** Serbian: **RAG pronalazi fragmente.** **Drugi mozak čuva kontinuitet rada.** ## What It Is AndyAI Second Brain is structured work memory for human-AI collaboration. It helps answer: - Wher",
      "reason": "Matched query terms in resource source.",
      "staleness_warning": ""
    },
    {
      "path": "brain/context/bundles/20260516T153539Z-pack3-evidence-decision-runtime-operations.md",
      "score": 74.0,
      "kind": "resource",
      "snippet": "# Context Bundle — PACK3 evidence decision runtime operations Created: `20260516T153539Z` Project: `not-specified` ## Sources ### 1. `brain/search/brain-index.json` - Score: `54.0` - Kind: `resource` - Reason: Matched query terms in resource source. > \"kind\": \"resource\", \"tokens\": 23, \"chars\": 175 }, { \"path\": \"brain/inbox/20260516T143358Z-pack3-sample-inbox-signal.md\", \"kind\": \"resource\", \"tokens\": 21, \"chars\":",
      "reason": "Matched query terms in resource source.",
      "staleness_warning": ""
    },
    {
      "path": "brain/context/bundles/20260516T153537Z-pack4-context-bundle-schema.json",
      "score": 53.0,
      "kind": "resource",
      "snippet": "{ \"query\": \"PACK4 context bundle schema\", \"project\": \"andyai-second-brain\", \"created_at\": \"20260516T153537Z\", \"sources\": [ { \"path\": \"brain/search/brain-index.json\", \"score\": 68.0, \"kind\": \"resource\", \"snippet\": \"{ \\\"created_at\\\": \\\"20260516T153536Z\\\", \\\"records\\\": [ { \\\"path\\\": \\\"ANDYAI_CONTEXT.md\\\", \\\"kind\\\": \\\"resource\\\", \\\"tokens\\\": 122, \\\"chars\\\": 945 }, { \\\"path\\\": \\\"SECOND_B",
      "reason": "Matched query terms in resource source.",
      "staleness_warning": ""
    },
    {
      "path": "brain/context/bundles/20260516T153537Z-pack4-context-bundle-schema.md",
      "score": 53.0,
      "kind": "resource",
      "snippet": "# Context Bundle — PACK4 context bundle schema Created: `20260516T153537Z` Project: `andyai-second-brain` ## Sources ### 1. `brain/search/brain-index.json` - Score: `68.0` - Kind: `resource` - Reason: Matched query terms in resource source. > { \"created_at\": \"20260516T153536Z\", \"records\": [ { \"path\": \"ANDYAI_CONTEXT.md\", \"kind\": \"resource\", \"tokens\": 122, \"chars\": 945 }, { \"path\": \"SECOND_BRAIN_CANON.md\", \"kind\"",
      "reason": "Matched query terms in resource source.",
      "staleness_warning": ""
    },
    {
      "path": "brain/queries/second-brain.json",
      "score": 44.0,
      "kind": "resource",
      "snippet": "{ \"query\": \"Second Brain\", \"created_at\": \"2026-05-16T14:36:21Z\", \"hits\": [ \"brain/decisions/adopt-local-runtime-layer.md\", \"brain/reports/pack2/v3.4.0.md\", \"brain/reports/pack2/v3.8.0.md\", \"brain/reports/pack2/v3.9.0.md\", \"brain/reports/pack2/v3.5.0.md\", \"brain/reports/pack2/v2.1.0.md\", \"brain/reports/pack2/v4.0.0.md\", \"brain/reports/pack2/v2.6.0.md\", \"brain/reports/pack2/v3.",
      "reason": "Matched query terms in resource source.",
      "staleness_warning": ""
    },
    {
      "path": "brain/reports/PACK3_DIRTY_TREE_REPAIR_STATUS.md",
      "score": 42.5,
      "kind": "report",
      "snippet": "# PACK3 Dirty Tree Repair Status - Repair tag: v6.0.1 - Base tag: v6.0.0 - Repo: andyai-second-brain - Path: /Users/andrijakolundzic/Documents/Projects/andyai-second-brain - Mode: LOCAL-FIRST / PUSH-LATER - Status before repair: ```text M brain/reports/brain-report.md M brain/search/brain-index.json M brain/search/brain-index.jsonl ``` ## Result This file is part of the v6.0.1 cleanup repair package. It record",
      "reason": "Matched query terms in report source.",
      "staleness_warning": ""
    },
    {
      "path": "brain/retrieval/20260516T153537Z-pack4-retrieval-result-schema.json",
      "score": 41.0,
      "kind": "resource",
      "snippet": "{ \"query\": \"PACK4 retrieval result schema\", \"project\": \"\", \"created_at\": \"20260516T153537Z\", \"results\": [ { \"path\": \"brain/search/brain-index.json\", \"score\": 55.0, \"kind\": \"resource\", \"snippet\": \"TEAM_BRAIN_MODEL.md\\\", \\\"kind\\\": \\\"resource\\\", \\\"tokens\\\": 36, \\\"chars\\\": 284 }, { \\\"path\\\": \\\"docs/PACK4_QUERY_RETRIEVAL_CONTEXT_ASSEMBLY_TOC.md\\\", \\\"kind\\\": \\\"resource\\\", \\\"tokens\\\": 250",
      "reason": "Matched query terms in resource source.",
      "staleness_warning": ""
    },
    {
      "path": "brain/queries/sample-second-brain-search.txt",
      "score": 40.0,
      "kind": "resource",
      "snippet": "brain/decisions/adopt-local-runtime-layer.md brain/reports/pack2/v3.4.0.md brain/reports/pack2/v3.8.0.md brain/reports/pack2/v3.9.0.md brain/reports/pack2/v3.5.0.md brain/reports/pack2/v2.1.0.md brain/reports/pack2/v4.0.0.md brain/reports/pack2/v2.6.0.md brain/reports/pack2/v3.2.0.md brain/reports/pack2/v3.3.0.md brain/reports/pack2/v2.7.0.md brain/reports/pack2/v2.8.0.md brain/reports/pack2/v3.0.0.md brain/reports/p",
      "reason": "Matched query terms in resource source.",
      "staleness_warning": ""
    },
    {
      "path": "SECOND_BRAIN_CANON.md",
      "score": 39.0,
      "kind": "resource",
      "snippet": "# 🅰️✅ CANON LOCK — AndyAI Second Brain AndyAI Second Brain is a separate canonical AndyAI pillar. It is not only part of Memory Runtime Lab, Knowledge Factory, Canonizer, TAP-TAP or Director. It connects all of them as a governed work-memory layer. ## Core Purpose Preserve work continuity across people, AI agents, projects, repositories, meetings, signals, decisions, evidence and reusable skills. ## Canonical Fo",
      "reason": "Matched query terms in resource source.",
      "staleness_warning": ""
    }
  ],
  "evidence": [],
  "warnings": [],
  "next_action": "Review context bundle, then decide whether to answer, inspect sources, or request human approval."
}
